{
  "claim_boundary": "NO_CLAIM_OF_CONFORMANCE",
  "generator": {
    "generator_id": "proofrail-esrm-repair1-inventory-generator",
    "generator_version": "0.1.0",
    "ordering": "lexicographic_by_vector_id",
    "prng": "ChaCha20",
    "reproduction_command": "python tools/generate_esrm_inventory.py --seed 1111... --version 0.1.0",
    "seed_hex": "1111111111111111111111111111111111111111111111111111111111111111"
  },
  "kind": "proofrail.esrm.binary-vector-manifest.repair1.v0.1",
  "schema_version": "esrm.v0.1",
  "vectors": [
    {
      "ambiguity_ids": [],
      "coverage_status": "mapped_planned",
      "enforcement_stage": "claim_boundary",
      "implementation_track": "artifact_only",
      "negative_vector_ids": [
        "ESRM-22-MUST-001-NEG"
      ],
      "normative_sentence": "A conformance artifact pack MUST identify this document as the repository-authoritative ESRM v0.1 baseline for Sections 22 through 48.",
      "positive_vector_ids": [
        "ESRM-22-MUST-001-POS"
      ],
      "requirement_ids": [
        "ESRM-22-MUST-001"
      ],
      "section": 22,
      "vector_id": "ESRM-R1-0001"
    },
    {
      "ambiguity_ids": [],
      "coverage_status": "mapped_planned",
      "enforcement_stage": "claim_boundary",
      "implementation_track": "artifact_only",
      "negative_vector_ids": [
        "ESRM-22-MUST-002-NEG"
      ],
      "normative_sentence": "A conformance artifact pack MUST distinguish NORMATIVE text from NON-NORMATIVE text.",
      "positive_vector_ids": [
        "ESRM-22-MUST-002-POS"
      ],
      "requirement_ids": [
        "ESRM-22-MUST-002"
      ],
      "section": 22,
      "vector_id": "ESRM-R1-0002"
    },
    {
      "ambiguity_ids": [],
      "coverage_status": "mapped_planned",
      "enforcement_stage": "claim_boundary",
      "implementation_track": "artifact_only",
      "negative_vector_ids": [
        "ESRM-22-MUST-NOT-001-NEG"
      ],
      "normative_sentence": "A conformance artifact pack MUST NOT treat examples, rationale, or implementation notes as normative requirements.",
      "positive_vector_ids": [],
      "requirement_ids": [
        "ESRM-22-MUST-NOT-001"
      ],
      "section": 22,
      "vector_id": "ESRM-R1-0003"
    },
    {
      "ambiguity_ids": [],
      "coverage_status": "mapped_planned",
      "enforcement_stage": "claim_boundary",
      "implementation_track": "artifact_only",
      "negative_vector_ids": [
        "ESRM-22-MUST-NOT-002-NEG"
      ],
      "normative_sentence": "A conformance artifact pack MUST NOT claim ESRM conformance before independent audit and before both Rust and Go implementations pass the finalized corpus.",
      "positive_vector_ids": [],
      "requirement_ids": [
        "ESRM-22-MUST-NOT-002"
      ],
      "section": 22,
      "vector_id": "ESRM-R1-0004"
    },
    {
      "ambiguity_ids": [],
      "coverage_status": "mapped_planned",
      "enforcement_stage": "raw_byte_intake",
      "implementation_track": "rust_and_go",
      "negative_vector_ids": [
        "ESRM-23-MUST-001-NEG"
      ],
      "normative_sentence": "An implementation MUST accept each artifact as an exact finite byte sequence before any decoding.",
      "positive_vector_ids": [
        "ESRM-23-MUST-001-POS"
      ],
      "requirement_ids": [
        "ESRM-23-MUST-001"
      ],
      "section": 23,
      "vector_id": "ESRM-R1-0005"
    },
    {
      "ambiguity_ids": [],
      "coverage_status": "mapped_planned",
      "enforcement_stage": "raw_byte_intake",
      "implementation_track": "rust_and_go",
      "negative_vector_ids": [
        "ESRM-23-MUST-002-NEG"
      ],
      "normative_sentence": "An implementation MUST record raw_byte_length before JSON parsing.",
      "positive_vector_ids": [
        "ESRM-23-MUST-002-POS"
      ],
      "requirement_ids": [
        "ESRM-23-MUST-002"
      ],
      "section": 23,
      "vector_id": "ESRM-R1-0006"
    },
    {
      "ambiguity_ids": [],
      "coverage_status": "mapped_planned",
      "enforcement_stage": "raw_byte_intake",
      "implementation_track": "rust_and_go",
      "negative_vector_ids": [
        "ESRM-23-MUST-003-NEG"
      ],
      "normative_sentence": "An implementation MUST record raw_sha256 as SHA-256 over the exact finite byte sequence.",
      "positive_vector_ids": [
        "ESRM-23-MUST-003-POS"
      ],
      "requirement_ids": [
        "ESRM-23-MUST-003"
      ],
      "section": 23,
      "vector_id": "ESRM-R1-0007"
    },
    {
      "ambiguity_ids": [],
      "coverage_status": "mapped_planned",
      "enforcement_stage": "raw_byte_intake",
      "implementation_track": "rust_and_go",
      "negative_vector_ids": [
        "ESRM-23-MUST-NOT-001-NEG"
      ],
      "normative_sentence": "An implementation MUST NOT normalize Unicode before raw_sha256 is recorded.",
      "positive_vector_ids": [],
      "requirement_ids": [
        "ESRM-23-MUST-NOT-001"
      ],
      "section": 23,
      "vector_id": "ESRM-R1-0008"
    },
    {
      "ambiguity_ids": [],
      "coverage_status": "mapped_planned",
      "enforcement_stage": "raw_byte_intake",
      "implementation_track": "rust_and_go",
      "negative_vector_ids": [
        "ESRM-23-MUST-NOT-002-NEG"
      ],
      "normative_sentence": "An implementation MUST NOT translate CRLF, CR, or LF before raw_sha256 is recorded.",
      "positive_vector_ids": [],
      "requirement_ids": [
        "ESRM-23-MUST-NOT-002"
      ],
      "section": 23,
      "vector_id": "ESRM-R1-0009"
    },
    {
      "ambiguity_ids": [],
      "coverage_status": "mapped_planned",
      "enforcement_stage": "raw_byte_intake",
      "implementation_track": "rust_and_go",
      "negative_vector_ids": [
        "ESRM-23-MUST-NOT-003-NEG"
      ],
      "normative_sentence": "An implementation MUST NOT infer a character encoding other than UTF-8.",
      "positive_vector_ids": [],
      "requirement_ids": [
        "ESRM-23-MUST-NOT-003"
      ],
      "section": 23,
      "vector_id": "ESRM-R1-0010"
    },
    {
      "ambiguity_ids": [],
      "coverage_status": "mapped_planned",
      "enforcement_stage": "json_parse",
      "implementation_track": "rust_and_go",
      "negative_vector_ids": [
        "ESRM-24-MUST-001-NEG"
      ],
      "normative_sentence": "After raw_sha256 is recorded, JSON artifacts MUST decode as valid UTF-8.",
      "positive_vector_ids": [
        "ESRM-24-MUST-001-POS"
      ],
      "requirement_ids": [
        "ESRM-24-MUST-001"
      ],
      "section": 24,
      "vector_id": "ESRM-R1-0011"
    },
    {
      "ambiguity_ids": [],
      "coverage_status": "mapped_planned",
      "enforcement_stage": "json_parse",
      "implementation_track": "rust_and_go",
      "negative_vector_ids": [
        "ESRM-24-MUST-002-NEG"
      ],
      "normative_sentence": "JSON artifacts MUST contain exactly one top-level JSON object.",
      "positive_vector_ids": [
        "ESRM-24-MUST-002-POS"
      ],
      "requirement_ids": [
        "ESRM-24-MUST-002"
      ],
      "section": 24,
      "vector_id": "ESRM-R1-0012"
    },
    {
      "ambiguity_ids": [],
      "coverage_status": "mapped_planned",
      "enforcement_stage": "json_parse",
      "implementation_track": "rust_and_go",
      "negative_vector_ids": [
        "ESRM-24-MUST-003-NEG"
      ],
      "normative_sentence": "JSON artifacts MUST reject duplicate object member names at every object depth.",
      "positive_vector_ids": [
        "ESRM-24-MUST-003-POS"
      ],
      "requirement_ids": [
        "ESRM-24-MUST-003"
      ],
      "section": 24,
      "vector_id": "ESRM-R1-0013"
    },
    {
      "ambiguity_ids": [],
      "coverage_status": "mapped_planned",
      "enforcement_stage": "json_parse",
      "implementation_track": "rust_and_go",
      "negative_vector_ids": [
        "ESRM-24-MUST-NOT-001-NEG"
      ],
      "normative_sentence": "JSON artifacts MUST NOT contain a UTF-8 BOM.",
      "positive_vector_ids": [],
      "requirement_ids": [
        "ESRM-24-MUST-NOT-001"
      ],
      "section": 24,
      "vector_id": "ESRM-R1-0014"
    },
    {
      "ambiguity_ids": [],
      "coverage_status": "mapped_planned",
      "enforcement_stage": "json_parse",
      "implementation_track": "rust_and_go",
      "negative_vector_ids": [
        "ESRM-24-MUST-NOT-002-NEG"
      ],
      "normative_sentence": "JSON artifacts MUST NOT contain leading whitespace before the top-level object.",
      "positive_vector_ids": [],
      "requirement_ids": [
        "ESRM-24-MUST-NOT-002"
      ],
      "section": 24,
      "vector_id": "ESRM-R1-0015"
    },
    {
      "ambiguity_ids": [],
      "coverage_status": "mapped_planned",
      "enforcement_stage": "json_parse",
      "implementation_track": "rust_and_go",
      "negative_vector_ids": [
        "ESRM-24-MUST-NOT-003-NEG"
      ],
      "normative_sentence": "JSON artifacts MUST NOT contain trailing bytes or trailing whitespace after the top-level object.",
      "positive_vector_ids": [],
      "requirement_ids": [
        "ESRM-24-MUST-NOT-003"
      ],
      "section": 24,
      "vector_id": "ESRM-R1-0016"
    },
    {
      "ambiguity_ids": [],
      "coverage_status": "mapped_planned",
      "enforcement_stage": "json_parse",
      "implementation_track": "rust_and_go",
      "negative_vector_ids": [
        "ESRM-24-MUST-NOT-004-NEG"
      ],
      "normative_sentence": "JSON artifacts MUST NOT use comments, trailing commas, NaN, Infinity, or implementation-specific JSON extensions.",
      "positive_vector_ids": [],
      "requirement_ids": [
        "ESRM-24-MUST-NOT-004"
      ],
      "section": 24,
      "vector_id": "ESRM-R1-0017"
    },
    {
      "ambiguity_ids": [],
      "coverage_status": "mapped_planned",
      "enforcement_stage": "semantic_validation",
      "implementation_track": "rust_and_go",
      "negative_vector_ids": [
        "ESRM-25-MUST-001-NEG"
      ],